P(1) N(0) UNKNOWN(2),
0,"Donald Trump spoke by telephone with Taiwan??s leader, which could lead to a major rift with China https://t.co/vPNhpVmytu g"
0,@realDonaldTrump are you really THAT much of a stupid mothers cunt? https://t.co/uIfbrjvpib
0,It's fascinating to me that Trump made it through a 18-month presidential campaign without once getting a serious question
0,Trump Organization eyes Taiwan for newest luxury resort location https://t.co/RuaFG6YTub https://t.co/je0TE0LXbE
1,Trump: Taiwan Media: China is gonna blow a gasket! China: Please don't do that again. Media: ... be furious!  China: Meh Public: W??b
0,"BEIJING (AP) ??China's foreign minister hopes US relations won't be ""interfered with or damaged"" after Trump speaks with T??n??"
0,REVEALED: Trump Organization eyes Taiwan for newest luxury resort location https://t.co/RuaFG6YTub https://t.co/je0TE0LXbE
0,"China's foreign minister hopes US relations won't be ""interfered with or damaged"" after Trump speaks with Taiwan leader."
0,"China lodges complaint over @realDonaldTrump-Taiwan call ""Trump was 'winging it"" with Taiwan call""  https://t.co/g2antuLmQ9??n"
1,Corrupt MSM says President-Elect Trump is not allowed to speak w/ Taiwan because Communist China says so. China does NOT tell??n
0,Why did he take call? Trump is considering building luxury resorts in Taiwan. A Trump representative visited Taoyuan in Sep??n
0,"@davidaxelrod @mariomartinv @realDonaldTrump trump knows exactly what he's doing! He's eyeing Taiwan to built hotels, etc..."
0,Trump's Taiwan phone call preceded by hotel development inquiry https://t.co/kWmIbzL2sS j9
1,Trump talked on the phone to Taiwan Obama sold billions in arms deals to Taiwan Who's Beijing upset with? https://t.co/??a
0,"Chinese foreign minister calls phone call between Taiwan's president and Trump ""just a small trick by Taiwan"" https://t.co/??n"
0,Obama breaks w/decades of US policy on Cuba &amp; gets endless fawning coverage. Trump breaks w/US policy by phoning Taiwan??t
0,Obama breaks w/decades of US policy on Cuba &amp; gets endless fawning coverage. Trump breaks w/US policy by phoning Taiwan??t
0,Trump has now 1. worried India by saying he'd visit Pakistan 2.invited Duterte to DC 3. angered China by speaking w Taiw??n
1,"I was at a conference of Taiwan experts &amp; officials today and we all agreed on the almost total lack of ""tensions"". [pre-??i"
1,IF Trump-Taiwan hadn't accepted the congratulatory phone call #BiasedMedia #Liberals would be calling him a sexist. https:??a
0,"Trump Org: ""we are not planning any expansion into Taiwan."" How abt this? Great find @mega2e https://t.co/zBLAHLeJmz htt??e fox news Saturday get it right. it's either 1000 jobs or 1100. either president elect Trump received a call or made a call to Taiwan. bad!"
0,Trump's Taiwan phone call preceded by hotel development inquiry https://t.co/nqKTBVr3eK
,
0,@FurForceFive proven help Russia and ties to  oil/gas aka ExxonMobil Taiwan hotels foreign govs booking Trump props he gets bids. #StopTrump
0,"President-elect Trump spoke directly with the president of Taiwan, a move that drew an irritated response from China https://t.co/GQ1mwYMbqQ"
0,What precipitated the deeply destructive rogue call to Taiwan? More than likely it was Michael Flynn whispering in Trump'??e
1,MSM says Trump can't talk to the leader of Taiwan but Hillary can accept millions of dollars from countries that enslave wome??e
0,Can you believe Donald Trump took a call from Taiwan without having them donate to his private foundation first?
0,This ????????? is ?????????exactly????????? why ????????? someone ?????????with?????????no?????????experience?????????should?????????not?????????have?????????been?????????elected?????????President????????? #Trump #Taiwan #?? Trump's ???????ignorance?€????? of foreign policy ????Taiwan???? Doesn't he have people versed in Geopolitics? ????December 1???? 2016??https://t.co/f0EyJXgCYSected?????????President?????
1,Well done #US Pres #DonaldTrump! #China lodges complaint over Trump-Taiwan call https://t.co/LNBryZwRd6 #Tibet #EU #UK #AUS??f
1,Taiwan says contact with Trump agreed ahead of time-presidential office https://t.co/Z4Xy7UybCb https://t.co/ZXN9OkY9mW
0,REVEALED: Trump Organization eyes Taiwan for newest luxury resort location https://t.co/RuaFG6YTub https://t.co/je0TE0LXbE
0,Trump??s phone call with Taiwan president sparks China complaint https://t.co/9WN6j1vhsl/t
0,RT @guardianworld: China lodges complaint with US over Trump's Taiwan phone call https://t.co/Venayg7eNz
,
0,Trump's Taiwan phone call preceded by hotel development inquiry https://t.co/d5zU6MJ9bY
1,So do this mean all the media outlets reporting that Trump called Taiwan are putting out fake news? @CNN ????dWy
1,Obama made a $1.8 billion arms deal with Taiwan &amp; media doesn't care. Trump had a phone with Taiwan &amp; he destroyed relatio??Y
0,"China's FM,Wang Yi, downplayed call between Taiwan's pres &amp; Trump: it was ""a small trick by Taiwan"" &amp; wouldn't change US polic??Y"
0,Trump's Taiwan phone call preceded by hotel development inquiry https://t.co/8QpoMC6cIl #World #Peace https://t.co/tcFzYQPJnE
1,"MSM continues to lie lie lie. Taiwan called Trump, He didn't call Taiwan."
1,Trump-Taiwan call: China lodges protest. Protest all they want. The call came from Taiwan! Good for him  https://t.co/9TbtXlICgx
0,#TrumpCalls: difficult to guess his intensions: https://t.co/uT2OyCzOvc
,
0,#Google #News Trump's Phone Call With Taiwan President Sparks China Complaint - Wall Street Journal https://t.co/AxCdEyDiRc
1,It's OK for Obama to give 500 billion dollars to Iran but Trump accepts a congratulatory call from Taiwan and the libs?? 
0,Taiwanese press that Trump and his children are in talks to build a series of luxury resorts and hotels in Taiwan. https:?? 
0,How do we know that the Trump overtures towards Taiwan and the Phillipines aren't motivated by personal commercial inter?? 
,
0,#diplomacy #Taiwan: @xeniawickett #ChathamHouse and speakers @IFRI_ 12.1: China should not be too pleased with the election of #Trump¡K China has lodged a diplomatic protest following Trump's call with Taiwan's president https://t.co/4kBooRWMyl
0,Trump's Taiwan phone call preceded by hotel development inquiry https://t.co/nqKTBVr3eK
,
0,"China blames Taiwan for president&amp;#039;s &amp;#039;petty&amp;#039; phone call with Trump, lodges protest https://t.co/37Ex5MBqtn"
0,Shorter: Rocket Scientist-In-Chief Trump gets played like a fiddle by President of #Taiwan. #TrumpTaiwan  https://t.co/rt??t
1,"Obama Administration Sold Weapons To Taiwan, But Trump Can't Accept A Congratulatory Phone Call From Them?"
0,#China #lodges #complaint #over #Trump #Taiwan #call #TrumpLeaks #TrumpTransition LEAVE THE PRESIDENT ALONE LET... htt?? 
0,Trump has now 1. worried India by saying he'd visit Pakistan 2.invited Duterte to DC 3. angered China by speaking w Taiw?? 
0,Trump has now 1. worried India by saying he'd visit Pakistan 2.invited Duterte to DC 3. angered China by speaking w Taiw?? 
0,"Chinese foreign minister calls phone call between Taiwan's president and Trump ""just a small trick by Taiwan"" https://t.co/?? "
0,"In 48 hours, #Trump Lied about #Carrier Deal, #Taiwan &amp;  I'm sure 5 more things. https://t.co/ZhuwXEnxH9"
0,Note: Trump's been eyeing a major real estate project in Taiwan!! Perfect e.g. of national security facets of Trump's conflic?? 
0,"Trump Org: ""we are not planning any expansion into Taiwan."" How abt this? Great find @mega2e https://t.co/zBLAHLeJmz htt?? "
1,Obama borrows $500 billion from China in 8 years. Media is silent Trump takes a phone call from Taiwan &amp; gets accused o?? 
0,Donald Trump speaks directly with Taiwan's president - breaking with US policy... https://t.co/3JfH5roNwN by #BBCBreaking via @c0nvey
0,This extract from my book Easternisation gives a flavour of why Trump's Taiwan phone call is so potentially dangerous ht?? 
0,Re: Trump &amp; Taiwan. Face it. Our president-elect is an imbecile. Incurious. Ignorant. Lazy. Dangerous. Imbecile. #WereSoScrew??i
0,China lodges complaint with US over Trump's Taiwan phone call https://t.co/BEew6CX0tb
